{
  "schema_version": 1,
  "schema_id": "whitewater-p25-artifact-v1",
  "status": "host_probe_cpu_cuda_passed",
  "purpose": "Phase 0B representative network; this does not select a shipping default",
  "candidate": {
    "id": "sea-raft-m",
    "role": "shipping-candidate",
    "family": "SEA-RAFT M",
    "notes": "Phase 0B qualification artifact; not a Phase 2.5 selection"
  },
  "upstream": {
    "repository": "https://github.com/princeton-vl/SEA-RAFT.git",
    "commit": "9137517ba24e628442aec097d3afe71d03503b75",
    "license": "BSD-3-Clause",
    "license_audit": "not_audited"
  },
  "checkpoint": {
    "repository": "https://huggingface.co/MemorySlices/Tartan-C-T-TSKH-spring540x960-M",
    "revision": "ea21e467a7076978b251e09d55751fcce166c2f8",
    "url": "https://huggingface.co/MemorySlices/Tartan-C-T-TSKH-spring540x960-M/resolve/ea21e467a7076978b251e09d55751fcce166c2f8/model.safetensors",
    "format": "safetensors",
    "size_bytes": 78778760,
    "sha256": "cb8cfbf14c5e0f6734b64add383708b7ff68cc6089a0007c67165d4761346102",
    "license": "unknown",
    "license_audit": "not_audited"
  },
  "backbone": {
    "applicable": true,
    "identity": "torchvision ResNet-34 ImageNet initialization",
    "provenance": "Constructed by the pinned SEA-RAFT source; complete SEA-RAFT checkpoint overwrites initialization",
    "repository": "https://pytorch.org/vision/stable/models.html",
    "revision": null,
    "checkpoint_sha256": null,
    "license": "BSD-3-Clause",
    "license_audit": "not_audited"
  },
  "licenses": {
    "code": {
      "license": "BSD-3-Clause",
      "audit": "not_audited",
      "commercial_use_permitted": "unknown",
      "redistribution_permitted": "unknown",
      "source": "upstream.license"
    },
    "checkpoint": {
      "license": "unknown",
      "audit": "not_audited",
      "commercial_use_permitted": "unknown",
      "redistribution_permitted": "unknown",
      "source": "checkpoint.license"
    },
    "backbone": {
      "license": "BSD-3-Clause",
      "audit": "not_audited",
      "commercial_use_permitted": "unknown",
      "redistribution_permitted": "unknown",
      "source": "backbone.license"
    }
  },
  "model": {
    "variant": "SEA-RAFT M",
    "config_source": "config/eval/spring-M.json",
    "config": {
      "use_var": true,
      "var_min": 0,
      "var_max": 10,
      "pretrain": "resnet34",
      "initial_dim": 64,
      "block_dims": [64, 128, 256],
      "radius": 4,
      "dim": 128,
      "num_blocks": 2,
      "iters": 4,
      "dropout": 0,
      "scale": -1
    }
  },
  "tensor_contract": {
    "inputs": [
      {
        "name": "image1",
        "dtype": "float32",
        "layout": "NCHW",
        "channels": "RGB",
        "range": [0, 255]
      },
      {
        "name": "image2",
        "dtype": "float32",
        "layout": "NCHW",
        "channels": "RGB",
        "range": [0, 255]
      }
    ],
    "output": {
      "name": "flow",
      "dtype": "float32",
      "layout": "NCHW",
      "channels": ["dx", "dy"],
      "units": "input_pixels",
      "direction": "image1_to_image2"
    },
    "normalization": "performed_in_graph: 2 * (image / 255) - 1",
    "normalization_location": "graph",
    "normalization_formula": "2 * (image / 255) - 1",
    "upstream_custom_py_input_scale": 0.5,
    "exported_forward_input_scale": 1.0,
    "padding": {
      "multiple": 8,
      "policy": "caller-replication-crop"
    },
    "batch": 1,
    "spatial_dimensions": "dynamic_multiples_of_8",
    "iterations": "4_baked_into_graph",
    "confidence": {
      "present": false,
      "name": null,
      "dtype": null,
      "layout": null
    },
    "graph_domains": ["ai.onnx"]
  },
  "export_environment": {
    "platform": "macos",
    "architecture": "arm64",
    "python": "3.11.15",
    "framework": "pytorch==2.2.0",
    "exporter": "torch.onnx==2.2.0",
    "runtime": "onnxruntime==1.29.0",
    "provider": "CPUExecutionProvider",
    "sha256": "b294d7fd5749f7342db289ad7a42e8bf654dc256450e41dcbc68f91c775c56ca"
  },
  "export": {
    "script": "models/export_searaft.py",
    "opset": 17,
    "example_shape": [1, 3, 128, 192],
    "artifact": "sea-raft-m-opset17.onnx",
    "sha256": "23cc2c850d3c116df193a24ff9ae7722d5635cd04e75dd8aeb20d7e13e4f59f1",
    "size_bytes": 78840944,
    "mode": "0644",
    "platform": "macos-arm64",
    "export_environment_sha256": "b294d7fd5749f7342db289ad7a42e8bf654dc256450e41dcbc68f91c775c56ca",
    "platform_artifacts": [
      {
        "platform": "macos-arm64",
        "artifact": "sea-raft-m-opset17.onnx",
        "sha256": "23cc2c850d3c116df193a24ff9ae7722d5635cd04e75dd8aeb20d7e13e4f59f1",
        "size_bytes": 78840944,
        "mode": "0644",
        "export_environment_sha256": "b294d7fd5749f7342db289ad7a42e8bf654dc256450e41dcbc68f91c775c56ca",
        "export_environment": {
          "platform": "macos",
          "architecture": "arm64",
          "python": "3.11.15",
          "framework": "pytorch==2.2.0",
          "exporter": "torch.onnx==2.2.0",
          "runtime": "onnxruntime==1.29.0",
          "provider": "CPUExecutionProvider",
          "sha256": "b294d7fd5749f7342db289ad7a42e8bf654dc256450e41dcbc68f91c775c56ca"
        }
      }
    ]
  },
  "validation": {
    "status": "passed",
    "identity": {
      "passed": true,
      "median_epe_px": 0.0039047328755259514
    },
    "directions": {
      "forward": {
        "median_dx_px": 4.004195213317871,
        "median_dy_px": 0.008690254762768745,
        "expected_sign": "positive_x"
      },
      "reverse": {
        "median_dx_px": -4.009702682495117,
        "median_dy_px": -0.00041637104004621506,
        "expected_sign": "negative_x"
      }
    },
    "shapes": {
      "dynamic": true,
      "example": [1, 2, 128, 192],
      "additional": [1, 2, 160, 256]
    },
    "parity": {
      "checked": true,
      "mean_abs": 0.032406385987997055,
      "p99_abs": 0.1393430083990097,
      "p999_abs": 0.3054158128798212,
      "max_abs": 3.0243895053863525
    },
    "seed": 20260820,
    "translation_pixels": 4,
    "second_dynamic_shape": [1, 3, 160, 256],
    "identity_median_epe_max": 0.75,
    "translation_x_fraction_min": 0.5,
    "translation_abs_y_max": 2.0,
    "onnx_pytorch_mean_abs_max": 0.05,
    "onnx_pytorch_p99_abs_max": 0.2,
    "onnx_pytorch_p999_abs_max": 0.5,
    "onnx_pytorch_max_abs_max": 4.0,
    "observed": {
      "environment": {
        "platform": "macOS arm64 26.6.2",
        "python": "3.11.15",
        "pytorch": "2.2.0",
        "onnx": "1.15.0",
        "onnxruntime": "1.29.0",
        "provider": "CPUExecutionProvider"
      },
      "graph_nodes": 1969,
      "graph_domains": ["ai.onnx"],
      "second_dynamic_shape": [1, 2, 160, 256],
      "onnx_pytorch_mean_abs": 0.032406385987997055,
      "onnx_pytorch_p99_abs": 0.1393430083990097,
      "onnx_pytorch_p999_abs": 0.3054158128798212,
      "onnx_pytorch_max_abs": 3.0243895053863525,
      "identity_median_epe": 0.0039047328755259514,
      "forward_median": [4.004195213317871, 0.008690254762768745],
      "reverse_median": [-4.009702682495117, -0.00041637104004621506]
    }
  }
}
